<?xml version="1.0" encoding="ISO-8859-1"?>



<clientes xmlns:xsi="http://www.w3.org/2001/XMLSchema-instance" xsi:noNamespaceSchemaLocation="clientesSchema.xsd">
    <sede codigo = "Q78945612">
        <empleado>Manolo Hinojo</empleado>
        <fecha>14/11/2019</fecha>
        <descripcion>solvente</descripcion>
        <cliente codigo = "AAA-111">
            <direccion>C/Vapabajo nº 11</direccion>
            <numeroviviendas>2</numeroviviendas>
            <coste>5000</coste>
            <resumen>"Inserte descripción"</resumen>
            <plazo>20/06/2020</plazo>
        </cliente>
    </sede>
    <sede codigo ="K34565432">
        <direccion>C/Empinao nº 5</direccion>
        <empleado>Juan Gómez</empleado>
        <fecha>20/04/2018</fecha>
        <descripcion>insolvente</descripcion>
        <cliente codigo = "ABC-431">
            <numeroviviendas>1</numeroviviendas>
            <coste>3000</coste>
            <resumen>"Inserte descripción"</resumen>
            <plazo>14/3/2020</plazo>
        </cliente>
    </sede>
</clientes>
